{
  "schema": 1,
  "id": "design-variants",
  "title": "Design variants",
  "lane": "design",
  "requires": ["agent-reach"],
  "inputs": {
    "brief": { "type": "text", "label": "Design brief", "required": true }
  },
  "budget": { "max_usd": 25, "max_minutes": 90, "max_parallel": 3 },
  "background": true,
  "layout": "variants-grid",
  "assists": [
    {"tool": "screenshot-to-code", "steps": ["variants"], "use": "turn a board reference into a starting variant"},
    {"tool": "storybook", "steps": ["variants"], "use": "component-level variants as stories, shown side by side"},
    {"tool": "talk-to-figma", "steps": ["directions"], "use": "read or write Figma frames when the brief starts in Figma"},
    {"tool": "odiff", "steps": ["polish"], "use": "pixel diff of the picked variant before and after polish"}
  ],
  "steps": [
    {
      "id": "board",
      "title": "Find references",
      "role": "research",
      "kind": "action",
      "uses": "plugin:agent-reach/inspiration-board",
      "with": { "brief": "{{inputs.brief}}" },
      "view": "board"
    },
    {
      "id": "directions",
      "title": "Write three directions",
      "role": "plan",
      "kind": "agent",
      "approval": "edits",
      "prompt": "Brief: {{inputs.brief}}\n\nReferences found for it: {{steps.board.outputs.references}}\n\nWrite three clearly different design directions for this brief, each grounded in named references. Write them to {{run.dir}}/direction-0.md, {{run.dir}}/direction-1.md and {{run.dir}}/direction-2.md: layout, type, colour, and which references it borrows from. Do not edit the repository.",
      "outputs": ["summary"]
    },
    {
      "id": "approve-directions",
      "title": "Approve the directions",
      "kind": "gate",
      "gate": "approve",
      "gate_summary": "Read {{run.dir}}/direction-0.md to direction-2.md. Approve to build all three, reject to stop."
    },
    {
      "id": "variants",
      "title": "Build each direction",
      "role": "worker",
      "kind": "agent",
      "engine": "claude",
      "approval": "contained",
      "fanout": 3,
      "worktree": true,
      "browser": true,
      "dev_command": "npm run dev -- --port {{port}}",
      "view": "variants-grid",
      "prompt": "If {{run.dir}}/direction-{{index}}.md does not exist, write status: failed and stop. Otherwise build the page it describes in this worktree, for this brief: {{inputs.brief}}\n\nMake `npm run dev -- --port <n>` serve it on port n. Stop any server you start before you finish; the workbench serves it and opens the preview once you are done. Commit your work on the current branch. Do not push.",
      "outputs": ["summary"]
    },
    {
      "id": "pick",
      "title": "Pick a variant",
      "kind": "gate",
      "gate": "handoff",
      "gate_summary": "Pick one tile in the variants grid (or Combine two), then Continue."
    },
    {
      "id": "polish",
      "title": "Polish the picked variant",
      "role": "worker",
      "kind": "agent",
      "engine": "claude",
      "approval": "contained",
      "cwd": "{{variants.picked.worktree}}",
      "prompt": "This worktree holds the picked design for: {{inputs.brief}}\n\nPolish it: fix spacing, contrast and alignment, make it work at 390 px wide, and keep the direction. Commit on the current branch ({{variants.picked.branch}}). Do not push.",
      "outputs": ["summary"]
    }
  ]
}
